review_seq,total_score,review_content,reg_date,images,writer_display_name
954405,5.0,"The pasta and fried vegetables (although there is no picture) were all good
GFRIEND, who had a low appetite, ate a lot of delicious food See you again",2022-10-17 15:13:22,"https://image.toast.com/aaaaaqx/rv/sGH-fb5s4R_O3VqK2Cu8qFw/221017151209736(0).jpeg, https://image.toast.com/aaaaaqx/rv/sGH-fb5s4R_O3VqK2Cu8qFw/221017151209739(1).jpeg",길핫트
1786356,5.0,"eat too deliciouslyby the look of it
Tiramisu is the only picture left

Black pork rago and red shrimp capellini are malmo 🫠🔥
The staff's service was so convenient",2023-05-30 18:45:48,https://image.toast.com/aaaaaqx/rv/sGH-fb5s4R_O3VqK2Cu8qFw/230530184354489(0).jpeg,엘츠비
1961507,5.0,"Not only the pasta, but the salad and carpaccio were so good It was more delicious because it was raw The kind service was also good I want to go again next time!",2023-08-21 14:57:08,"https://ugc-images.catchtable.co.kr/rv/sGH-fb5s4R_O3VqK2Cu8qFw/c46cf2c8c3564795aaa9dfbaf1dcb4a1, https://ugc-images.catchtable.co.kr/rv/sGH-fb5s4R_O3VqK2Cu8qFw/6b242376de344714b3a2befe42edd083",SJ_5
2626979,4.7,The view is a good view if you look forward to it and get disappointed and go without expectation. All the menus are delicious and the serving is kind~~,2024-04-14 12:08:20,,위트있는 식객_18159
2009959,5.0,"It didn't taste like pasta that I'm used to, so I was able to enjoy it more
The staff was kind and the food came out quickly, so it was good!!
Too bad we don't have beer 😭",2023-09-09 14:05:39,"https://image.toast.com/aaaaaqx/rv/sGH-fb5s4R_O3VqK2Cu8qFw/230909140402880(0).jpeg, https://image.toast.com/aaaaaqx/rv/sGH-fb5s4R_O3VqK2Cu8qFw/230909140402881(1).jpeg",개구진 개척가_25715
72624,5.0,"The table is well spaced, and most of all, the food is delicious and kind! I want to try other pasta too :)",2021-08-13 15:00:52,"https://image.toast.com/aaaaaqx/rv/sGH-fb5s4R_O3VqK2Cu8qFw/210813150046948(0).jpeg, https://image.toast.com/aaaaaqx/rv/sGH-fb5s4R_O3VqK2Cu8qFw/210813150046949(1).jpeg",꼼꼼한 미식가_69411
217392,5.0,"The explanation of the food was very kind and they cared about each and everything, so it was really good and the food suited my taste well :)",2021-12-26 18:18:31,https://image.toast.com/aaaaaqx/rv/sGH-fb5s4R_O3VqK2Cu8qFw/211226181824777(0).jpeg,발랄한 식도락가_16234
1709979,4.0,"Overall, I could feel a different taste. 
Especially, the capreze I had as an appetizer was the best! (Good pairing with sparkling wine...!!!) 
Personally, the other two foods had a unique taste at first, but as I ate them, I found them attractive! 
(I'm writing a review right now 🥹)
The server was kind, and I want to try other menus, so I'm willing to revisit :D",2023-04-13 21:53:51,"https://image.toast.com/aaaaaqx/rv/s7Agu-DWOBS3tEKBkEHyeRA/230413214606305(0).jpeg, https://image.toast.com/aaaaaqx/rv/s7Agu-DWOBS3tEKBkEHyeRA/230413214606306(1).jpeg, https://image.toast.com/aaaaaqx/rv/s7Agu-DWOBS3tEKBkEHyeRA/230413214606306(2).jpeg",suerte_
2306941,4.0,We had a good dinner. Everything was on point. Straightforward.,2023-12-25 19:52:51,"https://ugc-images.catchtable.co.kr/rv/sGH-fb5s4R_O3VqK2Cu8qFw/3b6e0fd7c6304003b518784f5d3db878, https://ugc-images.catchtable.co.kr/rv/sGH-fb5s4R_O3VqK2Cu8qFw/120983cf3b354ed8b903f48fffe98405, https://ugc-images.catchtable.co.kr/rv/sGH-fb5s4R_O3VqK2Cu8qFw/c0c239c46a724c15829a0891d600b896, https://ugc-images.catchtable.co.kr/rv/sGH-fb5s4R_O3VqK2Cu8qFw/5c941998adb4469e9d3ebdd8a4a2e779, https://ugc-images.catchtable.co.kr/rv/sGH-fb5s4R_O3VqK2Cu8qFw/27846721427f42aead86d27f850696ca, https://ugc-images.catchtable.co.kr/rv/sGH-fb5s4R_O3VqK2Cu8qFw/f24f46dc584f42c2a04e544f9aca316a",Jolyn Toh231120090951
2481224,4.3,"It's delicious. I liked it because I liked the pasta. I want to eat other menus, too. But the whole menu is salty. Honestly, I was a bit disappointed.",2024-02-18 23:47:25,"https://ugc-images.catchtable.co.kr/rv/sGH-fb5s4R_O3VqK2Cu8qFw/214b336b68c949cdb925d0da0b7d5630, https://ugc-images.catchtable.co.kr/rv/sGH-fb5s4R_O3VqK2Cu8qFw/8c1511a83b95405f89d09de7fa03fd5b, https://ugc-images.catchtable.co.kr/rv/sGH-fb5s4R_O3VqK2Cu8qFw/ce8900d506694ca78fc1311647f354ec, https://ugc-images.catchtable.co.kr/rv/sGH-fb5s4R_O3VqK2Cu8qFw/9bde3606847d40578f5f7b1c62ce64d2, https://ugc-images.catchtable.co.kr/rv/sGH-fb5s4R_O3VqK2Cu8qFw/26dfd1aee32f4432ba477a88e70f6def",이응이응기역이
2551260,5.0,"It's so delicious and I always go here when I go to Liberation Village. Hehe, and the staff are all so kind and the service is good!!",2024-03-16 21:10:32,https://ugc-images.catchtable.co.kr/rv/sGH-fb5s4R_O3VqK2Cu8qFw/85864f5e5ad7477792699ee0b7aedd8a,즐거운 식객_38394
45825,4.5,"It's a pretty and delicious place. The pasta with the texture of the raw pasta was great But personally, it's a bit salty. The view of Namsan Mountain from the window was cool, and the table was arranged so that it didn't feel crowded inside, so the atmosphere was good I recommend it as a good place to go when you want to eat pasta",2021-07-04 08:38:41,"https://image.toast.com/aaaaaqx/rv/sGH-fb5s4R_O3VqK2Cu8qFw/210704083743298(0).jpeg, https://image.toast.com/aaaaaqx/rv/sGH-fb5s4R_O3VqK2Cu8qFw/210704083743299(1).jpeg",예리한 개척가_98649
748418,5.0,"It's my second visit, and the staff were so kind and the atmosphere was crazy! It was good because the texture was good because it was raw and the menu was unique.",2022-08-24 20:07:26,"https://image.toast.com/aaaaaqx/rv/sGH-fb5s4R_O3VqK2Cu8qFw/22824200555674_rv.jpg, https://image.toast.com/aaaaaqx/rv/sGH-fb5s4R_O3VqK2Cu8qFw/22824200556000_rv.jpg",외로운 맛사냥꾼_68242
1739511,5.0,"The signature pasta is so delicious Other dishes are good, but I want to try something else",2023-05-02 20:03:51,"https://image.toast.com/aaaaaqx/rv/s7Agu-DWOBS3tEKBkEHyeRA/230502200315634(0).jpeg, https://image.toast.com/aaaaaqx/rv/s7Agu-DWOBS3tEKBkEHyeRA/230502200315635(1).jpeg",요정3
2075325,5.0,"It's not a reservation system, but I think I need to make a reservation It was very nice to see Namsan Tower well. The food was delicious, too!",2023-10-05 12:09:37,"https://ugc-images.catchtable.co.kr/rv/sGH-fb5s4R_O3VqK2Cu8qFw/4ecae1575e3c444fae7a2e9f07747401, https://ugc-images.catchtable.co.kr/rv/sGH-fb5s4R_O3VqK2Cu8qFw/a6ed8917b1a64497a3288b7997466333",호박바
2236355,5.0,"It's been a while since I had a date. It was a date
(Until the second one?)? (Laughing)
In winter, it changes to the terrace interior, so please refer to it^^",2023-12-05 20:12:07,https://ugc-images.catchtable.co.kr/rv/sGH-fb5s4R_O3VqK2Cu8qFw/456248da5d12489eb74843defa9f569f,이서경굥굥
956502,4.3,"The pasta is better than I expected The taste was good, and the liver was a little strong, but because of individual differences, the party was okay, so I think it's normal!",2022-10-18 00:17:32,"https://image.toast.com/aaaaaqx/rv/sGH-fb5s4R_O3VqK2Cu8qFw/221018001650907(0).jpeg, https://image.toast.com/aaaaaqx/rv/sGH-fb5s4R_O3VqK2Cu8qFw/221018001650908(1).jpeg, https://image.toast.com/aaaaaqx/rv/sGH-fb5s4R_O3VqK2Cu8qFw/221018001650908(2).jpeg, https://image.toast.com/aaaaaqx/rv/sGH-fb5s4R_O3VqK2Cu8qFw/221018001650908(3).jpeg, https://image.toast.com/aaaaaqx/rv/sGH-fb5s4R_O3VqK2Cu8qFw/221018001650908(4).jpeg",으헷헹
1133267,4.8,"First of all, the view was great I enjoyed the food, too! The wine you recommended was also good. :)",2022-11-25 19:29:13,,맛있는건너무조아
1577961,5.0,"Both the taste and service were the best. The food was a perfect seasoning to go with wine, and I want to revisit and eat other foods!",2023-01-22 21:34:23,"https://image.toast.com/aaaaaqx/rv/sGH-fb5s4R_O3VqK2Cu8qFw/23122213251339_rv.jpg, https://image.toast.com/aaaaaqx/rv/sGH-fb5s4R_O3VqK2Cu8qFw/23122213252904_rv.jpg",은창기
2587282,5.0,"I really like the view because it's a whole glass!
It's in the alley, so I don't think it's going to be easy to come by carㅜㅜ
But it's so delicious that I'll come back again",2024-03-30 20:29:34,https://ugc-images.catchtable.co.kr/rv/sGH-fb5s4R_O3VqK2Cu8qFw/a1fee409f54e49a3a1b3cdf5333478af,즐거운 식도락가_18822
1803262,5.0,"It tastes good, the quantity is good, the atmosphere is good, and the service is good. But parking is a shame ㅠ 
The pasta was so good",2023-06-09 22:18:07,https://image.toast.com/aaaaaqx/rv/sGH-fb5s4R_O3VqK2Cu8qFw/230609221738651(0).jpeg,으아닛
2544098,5.0,"The menu was so delicious and the wine paired together was good. Some people sell it because it's salty, but it was good for our taste.",2024-03-14 11:02:43,https://ugc-images.catchtable.co.kr/rv/sGH-fb5s4R_O3VqK2Cu8qFw/3bba080550cb4882ae1e6260dab63730,특별한 맛사냥꾼_27373
361837,5.0,"Maybe it's because I used raw noodles, but the texture is unique, and the food ingredients and the atmosphere service were all great",2022-03-15 16:46:22,https://image.toast.com/aaaaaqx/rv/sGH-fb5s4R_O3VqK2Cu8qFw/220315164519518(0).jpeg,크노
411768,5.0,The atmosphere is good and it's really delicious. 👍 The Michelin guide increases trust once again,2022-04-16 01:40:36,https://image.toast.com/aaaaaqx/rv/sGH-fb5s4R_O3VqK2Cu8qFw/220416013957517(0).jpeg,지혜로운 식객_70445
764546,5.0,"Thank you for the food! It's fun to break the menu They were so kind, so I enjoyed the meal",2022-08-28 20:10:05,"https://image.toast.com/aaaaaqx/rv/sGH-fb5s4R_O3VqK2Cu8qFw/22828200926382_rv.jpg, https://image.toast.com/aaaaaqx/rv/sGH-fb5s4R_O3VqK2Cu8qFw/22828200927053_rv.jpg",착한 셀럽_27177
1478144,4.3,"The atmosphere is good. Pasta is a place that shows that it's a noodle dish. A place where the atmosphere, service, and unique pasta blend.",2023-01-04 21:38:33,"https://image.toast.com/aaaaaqx/rv/sGH-fb5s4R_O3VqK2Cu8qFw/2314213739219_rv.jpg, https://image.toast.com/aaaaaqx/rv/sGH-fb5s4R_O3VqK2Cu8qFw/2314213739303_rv.jpg, https://image.toast.com/aaaaaqx/rv/sGH-fb5s4R_O3VqK2Cu8qFw/2314213738809_rv.jpg, https://image.toast.com/aaaaaqx/rv/sGH-fb5s4R_O3VqK2Cu8qFw/2314213739384_rv.jpg, https://image.toast.com/aaaaaqx/rv/sGH-fb5s4R_O3VqK2Cu8qFw/2314213739022_rv.jpg, https://image.toast.com/aaaaaqx/rv/sGH-fb5s4R_O3VqK2Cu8qFw/2314213739589_rv.jpg",여유로운 셀럽_83807
1513620,5.0,"It's a restaurant where you can't miss out on food and service
Pasta and steak. All the dishes are good
I'm willing to revisit!",2023-01-08 20:05:39,https://image.toast.com/aaaaaqx/rv/sGH-fb5s4R_O3VqK2Cu8qFw/2318200437852_rv.jpg,석재선
1852687,5.0,"The taste and atmosphere were great. 
The best was the kindness of the boss and the staff. 
100% willing to revisit",2023-07-08 13:28:50,"https://image.toast.com/aaaaaqx/rv/sGH-fb5s4R_O3VqK2Cu8qFw/230708132730710(0).jpeg, https://image.toast.com/aaaaaqx/rv/sGH-fb5s4R_O3VqK2Cu8qFw/230708132730712(1).jpeg",나소이
2495512,5.0,"The raw noodles were thin and soft, so it was delicious
Ragu is full of meat!! I ordered an extra baked baguette and applied it cleanly",2024-02-24 18:37:45,"https://ugc-images.catchtable.co.kr/rv/sGH-fb5s4R_O3VqK2Cu8qFw/132e3345b5ac407ba107f9b365ce9216, https://ugc-images.catchtable.co.kr/rv/sGH-fb5s4R_O3VqK2Cu8qFw/cab54bf63e984ee18e92f40621ed8841",미성이용
105498,5.0,"It was the best! It was a very special and happy meal! Especially, the salicy tea lemon butter is so delicious><",2021-09-23 21:08:54,https://image.toast.com/aaaaaqx/rv/sGH-fb5s4R_O3VqK2Cu8qFw/210923210742912(0).jpeg,호기심 많은 셀럽_98998
1098131,5.0,"I came here with my friends to celebrate my birthday, and they were delicious and kind, so I made good memories. I want to revisit^^",2022-11-19 20:04:53,https://image.toast.com/aaaaaqx/rv/sGH-fb5s4R_O3VqK2Cu8qFw/221119200421323(0).jpeg,오렌지루돌프
1683367,5.0,"Delicious food, fast and friendly serving, clean tableware and kitchen, and a nice atmosphere. It was a pleasant experience.",2023-03-26 14:05:03,"https://image.toast.com/aaaaaqx/rv/s7Agu-DWOBS3tEKBkEHyeRA/230326140417191(0).jpeg, https://image.toast.com/aaaaaqx/rv/s7Agu-DWOBS3tEKBkEHyeRA/230326140417192(1).jpeg",Jinu_J
2245641,5.0,"The pasta noodles are really delicious! You said the steak takes 30 minutes, but I think it came out quickly. It was delicious!",2023-12-09 18:36:06,"https://ugc-images.catchtable.co.kr/rv/sGH-fb5s4R_O3VqK2Cu8qFw/1c06e7b64205429e8aef93bc377a5f54, https://ugc-images.catchtable.co.kr/rv/sGH-fb5s4R_O3VqK2Cu8qFw/21c1abb8a50d43e5a354825e856fb8be",밝은 맛사냥꾼_71699
1717702,4.7,"The taste was still good, but it was too bad that I couldn't enjoy the view by making the second floor right away.. The space between the seats in the store has become much smaller In the past, I went to enjoy a leisurely view in a large space without infringement.. I was sad because the atmosphere changed a lot I don't think I'll go as often as I used to🥲",2023-04-18 15:42:38,https://image.toast.com/aaaaaqx/rv/s7Agu-DWOBS3tEKBkEHyeRA/230418154105176(0).jpeg,펭구핑
1921154,5.0,"It was delicious
From appetizers to pasta and tiramisu
The service was great and the seats were great",2023-08-07 12:28:09,https://ugc-images.catchtable.co.kr/rv/sGH-fb5s4R_O3VqK2Cu8qFw/746177f7f4414dbb817f7f4a59340979,남인희
572966,5.0,"The pasta was good, but.. This cuttlefish and fried vegetables were delicious, too! It was a new texture and scent",2022-06-29 20:47:11,https://image.toast.com/aaaaaqx/rv/sGH-fb5s4R_O3VqK2Cu8qFw/220629204626781(0).jpeg,밝은 식객_71979
1671397,5.0,"I tasted the pasta of my life. It's the best
It's red shrimp and capellini...
I can't speak",2023-03-18 22:47:07,https://image.toast.com/aaaaaqx/rv/sGH-fb5s4R_O3VqK2Cu8qFw/230318224703645(0).jpeg,지혜로운 개척가_99925
183180,5.0,"It was the best taste, hospitality, kindness It's the best restaurant in my life♥",2021-12-05 21:05:41,https://image.toast.com/aaaaaqx/rv/sGH-fb5s4R_O3VqK2Cu8qFw/211205210504910(0).jpeg,특별한 식도락가_35039
1866806,4.7,"Thank you for your kind response since you contacted me earlier than the scheduled time!!
It didn't take long to get out after ordering food, and it was so nice to have a window seat with a good view!
I'm happy that I ate deliciously and had a good time! 
Thank you!! I really enjoyed the meal.",2023-07-16 21:54:41,"https://image.toast.com/aaaaaqx/rv/sGH-fb5s4R_O3VqK2Cu8qFw/23716215306164_rv.jpg, https://image.toast.com/aaaaaqx/rv/sGH-fb5s4R_O3VqK2Cu8qFw/23716215306653_rv.jpg",Junhaeng
268229,4.5,"It's good to take care of the emotions with your loved ones you love
Red shrimp capellini has a strong shrimp flavor, but it feels like it's in harmony with noodles and sauce
I don't know if it's because it's raw, but it's less burdensome
I think it would have been better if I sat in a place where I could see Namsan Tower
I'm willing to revisit!",2022-01-23 00:39:32,https://image.toast.com/aaaaaqx/rv/sGH-fb5s4R_O3VqK2Cu8qFw/220123003715546(0).jpeg,선의의재성
2024975,5.0,"I often visit with your friends because my office is in front of me :)
First of all, it's so delicious because it's raw :)",2023-09-15 12:06:42,https://ugc-images.catchtable.co.kr/rv/sGH-fb5s4R_O3VqK2Cu8qFw/d6fc2a894b8849bcb9959b3116147b91,minji86
1451942,5.0,"It was really delicious.
The squid ink itself is a bit salty, but it was perfect for my taste.",2023-01-01 10:03:35,https://image.toast.com/aaaaaqx/rv/sGH-fb5s4R_O3VqK2Cu8qFw/2311100127978_rv.jpg,경호라네
1727054,5.0,"Not to mention the atmosphere
The taste and kindness are perfect
It's so nice to be able to get a call",2023-04-24 15:20:09,"https://image.toast.com/aaaaaqx/rv/s7Agu-DWOBS3tEKBkEHyeRA/23424151847093_rv.jpg, https://image.toast.com/aaaaaqx/rv/s7Agu-DWOBS3tEKBkEHyeRA/23424151847340_rv.jpg",재미있는 셀럽_56971
1876688,5.0,"I went with my girlfriend.
It was a really high quality pasta and it was delicious!
The view was so nice!",2023-07-22 20:03:24,https://ugc-images.catchtable.co.kr/rv/sGH-fb5s4R_O3VqK2Cu8qFw/6e2edcd3c9a44bbc8ce82a6e2e904fba,태브로
2209533,4.3,"I made a reservation based on the view only! But it tasted good, too. Haha, it's not a small amount for a Western course",2023-11-26 13:25:43,"https://ugc-images.catchtable.co.kr/rv/sGH-fb5s4R_O3VqK2Cu8qFw/930055a9460d49dfa3e55bf91a311966, https://ugc-images.catchtable.co.kr/rv/sGH-fb5s4R_O3VqK2Cu8qFw/a2606e32683b44cd82ecbc3651389381, https://ugc-images.catchtable.co.kr/rv/sGH-fb5s4R_O3VqK2Cu8qFw/9052e611c0654a0f8e7790696b8717de, https://ugc-images.catchtable.co.kr/rv/sGH-fb5s4R_O3VqK2Cu8qFw/8606fe4f941f4f08aefa9c0af48476d9, https://ugc-images.catchtable.co.kr/rv/sGH-fb5s4R_O3VqK2Cu8qFw/371d682fff854ee7aa4b60f23188bd56, https://ugc-images.catchtable.co.kr/rv/sGH-fb5s4R_O3VqK2Cu8qFw/d09a299f0faf4118a6ca3c9295fa94c8, https://ugc-images.catchtable.co.kr/rv/sGH-fb5s4R_O3VqK2Cu8qFw/ee651b16e97246b7acf8b5a9cf256af3, https://ugc-images.catchtable.co.kr/rv/sGH-fb5s4R_O3VqK2Cu8qFw/450e358a68ce4c1ba6cbdfe64b3633b2",드링글
1711087,5.0,I want to visit next time and try all kinds of pasta! And make sure to order a bite of charcoal🥹,2023-04-14 19:16:55,https://image.toast.com/aaaaaqx/rv/s7Agu-DWOBS3tEKBkEHyeRA/230414191557804(0).jpeg,솔직한 맛사냥꾼_52194
1997385,5.0,All the dishes were delicious and the atmosphere was good.. I'm going to visit again soon ❤️,2023-09-03 21:34:20,https://ugc-images.catchtable.co.kr/rv/sGH-fb5s4R_O3VqK2Cu8qFw/6c7b3b89842349e6b873a69862c182f3,도치새우
2536534,5.0,"There's a reason why the service is excellent, excellent, excellent, blue ribbon survey restaurant for 5 years. Oh! 👍",2024-03-11 08:24:15,https://ugc-images.catchtable.co.kr/rv/sGH-fb5s4R_O3VqK2Cu8qFw/51682e39272946fbbb52ffaed963942e,donggikorea
1547560,3.8,"The most delicious thing was the red shrimp ink capellini. Noodles were good and especially the sauce was really good, but everyone even said they wanted to order extra rice and mix it. I ate it all. If I visit again, I think this menu will be the reason.

Black pork ragu ink stickoni was really chewy, but I personally felt that the sauce was a bit ambiguous because it had a strong scent. It was okay, but I don't think I'll order it next time. And the chuck flap tail was simply delicious.

It was not a big store where many customers could come in, so it was not too noisy, and the night view outside was pretty, so the atmosphere was good.",2023-01-13 21:55:13,"https://image.toast.com/aaaaaqx/rv/sGH-fb5s4R_O3VqK2Cu8qFw/230113214820174(0).jpeg, https://image.toast.com/aaaaaqx/rv/sGH-fb5s4R_O3VqK2Cu8qFw/230113214820176(1).jpeg, https://image.toast.com/aaaaaqx/rv/sGH-fb5s4R_O3VqK2Cu8qFw/230113214820176(2).jpeg, https://image.toast.com/aaaaaqx/rv/sGH-fb5s4R_O3VqK2Cu8qFw/230113214820176(3).jpeg, https://image.toast.com/aaaaaqx/rv/sGH-fb5s4R_O3VqK2Cu8qFw/230113214844236(0).jpeg, https://image.toast.com/aaaaaqx/rv/sGH-fb5s4R_O3VqK2Cu8qFw/230113214844237(1).jpeg",찜계
1595035,5.0,The best birthday present.. The lemon butter and vongole combination doesn't bite and keeps going in. It's so good..🥹,2023-02-02 22:06:28,https://image.toast.com/aaaaaqx/rv/sGH-fb5s4R_O3VqK2Cu8qFw/230202220436728(0).jpeg,개구진 개척가_39300
1690160,5.0,The pasta was so good He kindly explained the menu well and the atmosphere was great,2023-03-31 14:21:14,https://image.toast.com/aaaaaqx/rv/s7Agu-DWOBS3tEKBkEHyeRA/230331142035985(0).jpeg,꽃빵이
1939616,5.0,"It was the best squid ink capellini^^!
It's a small pasta place with a nice view",2023-08-14 10:31:03,https://ugc-images.catchtable.co.kr/rv/sGH-fb5s4R_O3VqK2Cu8qFw/f137438d033f455091827bbf593b993c,미쓰리
1588963,5.0,"It was my first time eating pasta, and it was delicious. It was delicious. They recommended the menu. It was good!",2023-01-29 19:57:00,"https://image.toast.com/aaaaaqx/rv/sGH-fb5s4R_O3VqK2Cu8qFw/23129195636451_rv.jpg, https://image.toast.com/aaaaaqx/rv/sGH-fb5s4R_O3VqK2Cu8qFw/23129195636222_rv.jpg",뽀소
134770,5.0,"The taste, the atmosphere, and kindness are all the best
Make a reservation in advance",2021-10-24 21:45:27,https://image.toast.com/aaaaaqx/rv/sGH-fb5s4R_O3VqK2Cu8qFw/211024214443699(0).jpeg,이상원SW
1039639,5.0,"It's so good! The view is nice and the staff are kind and the amount is small, but it's okay!",2022-11-06 15:33:09,https://image.toast.com/aaaaaqx/rv/sGH-fb5s4R_O3VqK2Cu8qFw/22116153239010_rv.jpg,남다른 식도락가_11961
1591491,5.0,"The taste and service are excellent. 
I emptied the plate to see how delicious it was.",2023-01-31 14:15:56,https://image.toast.com/aaaaaqx/rv/sGH-fb5s4R_O3VqK2Cu8qFw/230131141538193(0).jpeg,지혜예옥빛린
1693264,5.0,I'll be there until I get all the menus on the menu. I'm gonna lick your plate,2023-04-01 23:02:06,https://image.toast.com/aaaaaqx/rv/s7Agu-DWOBS3tEKBkEHyeRA/230401230137978(0).jpeg,나는야 밍슐랭 빵야빵야
2249035,5.0,"The directions of the store are kind, the pasta is delicious, and the person who went with me is pretty.😁",2023-12-10 16:31:49,https://ugc-images.catchtable.co.kr/rv/sGH-fb5s4R_O3VqK2Cu8qFw/e272815e850443b8a458980ed60f64bb,재미있는 식도락가_53185
1596188,5.0,"The two of us ordered 6 kinds of food
I really enjoyed the meal.
I'm willing to revisit",2023-02-03 20:04:30,https://image.toast.com/aaaaaqx/rv/sGH-fb5s4R_O3VqK2Cu8qFw/230203200303085(0).jpeg,외로운 식객_46532
1649126,4.7,"I don't really use reviews. 여기 This pasta is delicious as a gel among the pasta with raw pasta hair. 🥺 Especially, signature ink pasta, order radish jokwon.. ⛧ My husband made a reservation and visited me to celebrate my birthday, but the atmosphere was nice and I had a happy time thanks to you🫶🏻",2023-03-05 00:15:02,"https://image.toast.com/aaaaaqx/rv/sGH-fb5s4R_O3VqK2Cu8qFw/230305001216547(0).jpeg, https://image.toast.com/aaaaaqx/rv/sGH-fb5s4R_O3VqK2Cu8qFw/230305001227733(0).jpeg",윤버드
2050108,4.3,"I love the atmosphere😘
❤️ Parking
First, come to the valet and check it out, and if there isn't, go to the public parking lot!The public parking lot is harder
❤️ Liquor
I'm a little sad that you didn't explain what kind of wine it is, but it was delicious
❤️ Food
The pasta was cooked in moderation, so it was really. Truffles were really ""Wow, it's delicious!"" and ribs kept going in like ""Huh? It's delicious!""",2023-09-24 20:38:05,"https://ugc-images.catchtable.co.kr/rv/sGH-fb5s4R_O3VqK2Cu8qFw/2875e57cb5ba4087bf27d6a87fe0d89e, https://ugc-images.catchtable.co.kr/rv/sGH-fb5s4R_O3VqK2Cu8qFw/8a57df0e3793408d87ee7bd2ef97e52d, https://ugc-images.catchtable.co.kr/rv/sGH-fb5s4R_O3VqK2Cu8qFw/12fe03fbbecc4eef8f67bee40a928f4e",진라니
272081,5.0,I loved the texture of the noodles and the flavor of the mushrooms,2022-01-25 01:41:45,https://image.toast.com/aaaaaqx/rv/sGH-fb5s4R_O3VqK2Cu8qFw/220125014133784(0).jpeg,중오기범
1030387,5.0,"Everything on the menu was delicious, and I think the noodles themselves are delicious. The lemon tiramisu for dessert was also great.
The view is nice. It's not loud and it's a great place for day dates.
What's a bit disappointing is that it feels like there's not enough ventilation?
The indoor air was bad because the scented candle(?) + cooking smell was mixed..ㅜ",2022-11-04 16:10:56,https://image.toast.com/aaaaaqx/rv/sGH-fb5s4R_O3VqK2Cu8qFw/221104160908007(0).jpeg,요용요요용
2333775,4.5,"1. Parking is inconvenient, but the characteristics of Liberation Village
2. The menu comes out fast
3. Pasta is delicious. It's the best pasta I had recently
The sauce goes well with the noodles
4. The terrace needs some heating
5. The store's light is soft, so the atmosphere is good
6. I'm going to go eat again
7. The price is reasonable, too",2023-12-30 20:41:12,https://ugc-images.catchtable.co.kr/rv/sGH-fb5s4R_O3VqK2Cu8qFw/6bb7d6f0f7814ac3bfbb078912627d0b,노루킹
348931,4.0,"Pasta noodles are fresh, so the texture is good and it's so good^^
The cabbage pickle I tried for the first time was fresh and delicious.
It's just a little bit short of the price. So I ordered baguette bread and a glass of wine, but the amount was too smallCompared to other restaurants.. But the meal tasted so satisfying.
I think it'd be good to lower the coke charge",2022-03-07 21:05:28,"https://image.toast.com/aaaaaqx/rv/sGH-fb5s4R_O3VqK2Cu8qFw/2237210404115_rv.jpg, https://image.toast.com/aaaaaqx/rv/sGH-fb5s4R_O3VqK2Cu8qFw/2237210404684_rv.jpg, https://image.toast.com/aaaaaqx/rv/sGH-fb5s4R_O3VqK2Cu8qFw/2237210405135_rv.jpg",jeanny62 
2139765,5.0,"The atmosphere is good and the wine and pasta are all good
Best pasta ever 😍 I think so 👍🏻",2023-10-31 13:47:46,https://ugc-images.catchtable.co.kr/rv/sGH-fb5s4R_O3VqK2Cu8qFw/ceb2f3f15df34572bf6f535f18d41f40,마늘추추가
1147951,4.5,The food is delicious and the view is nice. You may go there at least once.,2022-11-27 19:01:56,,리골레토
1202073,4.5,"a delicious combination of raw noodles and harmonious sauce
Ah! I want to eat it again!",2022-12-06 15:31:40,,SYKim.
549896,5.0,It's good. I'm willing to revisit it! Everything I ordered was delicious,2022-06-19 11:09:18,https://image.toast.com/aaaaaqx/rv/sGH-fb5s4R_O3VqK2Cu8qFw/220619110752903(0).jpeg,인기많은 마스터_3096
2246850,4.8,"Great taste, reasonable champagne price, friendly explanation and support from staff
It was a restaurant where the three beats were perfect until then.
You can enjoy the view while eating, and the window section is really 
You can eat beautifully everywhere you look
Recommended menu to visit several times is diverse and tastes really good.",2023-12-09 21:43:07,https://ugc-images.catchtable.co.kr/rv/sGH-fb5s4R_O3VqK2Cu8qFw/40cb397fb82d4bbba1d4d513f8bda1d5,바라겨울
