review_seq,total_score,review_content,reg_date,images,writer_display_name
1701033,4.2,"I personally didn't like seafood/shrimp sauce, but truffle cream mushroom pasta was so good I loved the pairings🍷",2023-04-07 21:43:39,https://image.toast.com/aaaaaqx/rv/s7Agu-DWOBS3tEKBkEHyeRA/230407214236482(0).jpeg,공덕동날다람쥐
2011744,5.0,Delicious noodles and great wine! Sat on the terrace and had an amazing view of the city and Seoul tower! Absolutely recommend. ,2023-09-09 20:52:20,,Quincy Smith230907213558
1482064,5.0,"All the menus are dishes that came out after studying hard^^
a completely unexpected combination of food ingredients.
Taste. Visual. Every single one 
It's outstanding!
There's no place like this!👍
I'm Egg&Flour heart's content.
I strongly recommend it👍👍👍",2023-01-05 15:41:52,,Amway 
1952852,4.0,"The food is generally salty..
You can choose a weak liver, but it's a bit salty!
Don't think of regular pasta.
The atmosphere service is excellent",2023-08-18 19:36:54,https://ugc-images.catchtable.co.kr/rv/sGH-fb5s4R_O3VqK2Cu8qFw/5ebe22dd568349ef9103efeba5cecd7b,림림파이어
900443,4.2,"I enjoyed the pasta. It's not a must, but it was too tight👍",2022-10-03 21:29:02,,완끼
2155724,5.0,"I had yellow lemon pasta and black ragu

Yellow Pasta: I felt like I was eating a deep cheese pizza It's delicious and thick, but I kept the line well.

Black Ragu: There was Ragu in the noodles, so the chewing and oozing taste gave me a good experience.",2023-11-06 12:46:06,,깜찍한 마스터_82726
2496883,4.0,"All the food was delicious, but it took a long time to come out and I liked the exotic atmosphere of Liberation Village Parking was really difficult, so public transportation is essential",2024-02-24 22:52:14,"https://ugc-images.catchtable.co.kr/rv/sGH-fb5s4R_O3VqK2Cu8qFw/1e6df3bf264e46b78ac79077751e78e3, https://ugc-images.catchtable.co.kr/rv/sGH-fb5s4R_O3VqK2Cu8qFw/108de2f4a601491abfe057d93e470ce7",킴귤이
2633926,4.3,"It's delicious, and the server is so kind that I'm touched",2024-04-16 17:23:12,,화려한 개척가_5509
1463263,4.3,"It was delicious.
However, if you make a reservation with a catch table, you must order wine, but it seemed possible to have a walk-in meal without having to reserve a catch table.",2023-01-02 15:16:23,https://image.toast.com/aaaaaqx/rv/sGH-fb5s4R_O3VqK2Cu8qFw/230102151521526(0).jpeg,meaningly
1795374,4.0,It's good. But I didn't like the fact that I had to order alcoholic beverages no matter what and that many people were waiting for me even 5 minutes before the opening,2023-06-04 23:23:31,"https://image.toast.com/aaaaaqx/rv/sGH-fb5s4R_O3VqK2Cu8qFw/230604232326396(0).jpeg, https://image.toast.com/aaaaaqx/rv/sGH-fb5s4R_O3VqK2Cu8qFw/230604232326397(1).jpeg",맛있는게조하 하하 
1871099,5.0,"The owner is so kind, not to mention the taste!! It's my first time trying pasta noodles, and the sauce was cut well and the texture was good. Not to mention the tenderness of the flesh! I was happy to eat delicious dinner while looking at Namsan view Thank you 🫶🏻",2023-07-19 23:56:58,,twinkle_emma88
1864380,4.2,"The pasta sauce is unique, very delicious, and the presentation is excellent. I think the texture was better because it was raw pasta. I'll come back to eat again",2023-07-15 20:00:30,"https://image.toast.com/aaaaaqx/rv/sGH-fb5s4R_O3VqK2Cu8qFw/230715195813884(0).jpeg, https://image.toast.com/aaaaaqx/rv/sGH-fb5s4R_O3VqK2Cu8qFw/230715195813885(1).jpeg",아이스아메리카노얼음많이
1180758,4.3,Thank you for the food! I especially liked truffle porcini pasta The French fries were also fragrant and delicious I want to visit again!,2022-12-03 16:43:54,"https://image.toast.com/aaaaaqx/rv/sGH-fb5s4R_O3VqK2Cu8qFw/22123164112897_rv.jpg, https://image.toast.com/aaaaaqx/rv/sGH-fb5s4R_O3VqK2Cu8qFw/22123164113097_rv.jpg",yoon2017
901397,4.3,"It's cozy and the atmosphere is nice
I liked the noodles, too
He's kind",2022-10-04 00:27:52,,Eun_D
1105419,4.3,"I went because an acquaintance recommended it
Food is the best^^
I don't know if it's because of COVID-19 or because of the cold weather
It's sad that I couldn't take the best picture on the terrace",2022-11-20 16:19:11,"https://image.toast.com/aaaaaqx/rv/sGH-fb5s4R_O3VqK2Cu8qFw/221120161731953_rv.jpg, https://image.toast.com/aaaaaqx/rv/sGH-fb5s4R_O3VqK2Cu8qFw/221120161732050_rv.jpg",놀래롱
1432182,4.0,"Shrimp something and truffle something together. It's delicious, but I really craved Zero Cola...
Beverage order required
Next time, I'm going to order galbi something",2022-12-30 20:05:30,https://image.toast.com/aaaaaqx/rv/sGH-fb5s4R_O3VqK2Cu8qFw/221230200423837_rv.jpg,세인츠
1924420,5.0,"Very nice location with a beautiful view , warm greeting and service, and excellent food…and dessert: lemon tiramisu!",2023-08-08 15:51:54,,Francesco
116139,4.0,"The service is good 
Pasta is not salty and seasoned properly
I think it'll be better if you come on a nice day",2021-10-05 20:21:29,"https://image.toast.com/aaaaaqx/rv/sGH-fb5s4R_O3VqK2Cu8qFw/211005201925448(0).jpeg, https://image.toast.com/aaaaaqx/rv/sGH-fb5s4R_O3VqK2Cu8qFw/211005201925450(1).jpeg",조종사
1830320,4.3,"It was delicious after two bowls, so I added truffle pasta and truffle slice rice, but the atmosphere was good and delicious except for the very low truffle quality",2023-06-25 11:18:49,https://image.toast.com/aaaaaqx/rv/sGH-fb5s4R_O3VqK2Cu8qFw/230625111540053(0).jpeg,Hjkimmm
2285737,3.7,"I ordered a lunch set for three people at 150,000 won.
The amount was really large…
But I definitely asked for it to be light...I planned it too much

It would have been really good if it wasn't salty...ㅜㅜ I left a lot because it was salty.
It tasted the best…",2023-12-22 15:56:03,"https://ugc-images.catchtable.co.kr/rv/sGH-fb5s4R_O3VqK2Cu8qFw/18059fce78444213bde2f2652a425eb5, https://ugc-images.catchtable.co.kr/rv/sGH-fb5s4R_O3VqK2Cu8qFw/86d4064601c64c61845b03b859235b83, https://ugc-images.catchtable.co.kr/rv/sGH-fb5s4R_O3VqK2Cu8qFw/1e27e1f5d74e4174ba31c7b54af29651",써머0823
636779,5.0,"I visited for my husband's birthday, and the view of Namsan Mountain from outside is also very good The pasta is so good
I'm going to order pasta instead of meat
And the dessert is tiramisu. It's👍👍👍👍",2022-07-23 20:14:46,,여유로운 마스터_72776
145036,4.0,I liked the quiet atmosphere. It was nice to be able to eat various kinds of pasta.,2021-11-04 16:29:50,https://image.toast.com/aaaaaqx/rv/sGH-fb5s4R_O3VqK2Cu8qFw/211104162948722(0).jpeg,개미녁
634433,5.0,"It felt like I had never tried pasta before, but it was very different and full of seafood!
The chuck flap tail steak was also the best. 😆 I really enjoyed the meal
Thank you so much for letting me blow my birthday cake",2022-07-23 01:41:59,"https://image.toast.com/aaaaaqx/rv/sGH-fb5s4R_O3VqK2Cu8qFw/220723014213595(0).jpeg, https://image.toast.com/aaaaaqx/rv/sGH-fb5s4R_O3VqK2Cu8qFw/220723014213596(1).jpeg, https://image.toast.com/aaaaaqx/rv/sGH-fb5s4R_O3VqK2Cu8qFw/220723014213596(2).jpeg, https://image.toast.com/aaaaaqx/rv/sGH-fb5s4R_O3VqK2Cu8qFw/220723014213597(3).jpeg",Cookielol
1733551,4.3,"The seasoning is strong overall, but the atmosphere is good and the food is good, too
I drank it! Personally, steak is better than pasta",2023-04-29 14:04:54,"https://image.toast.com/aaaaaqx/rv/s7Agu-DWOBS3tEKBkEHyeRA/230429140348188(0).jpeg, https://image.toast.com/aaaaaqx/rv/s7Agu-DWOBS3tEKBkEHyeRA/230429140348189(1).jpeg",아기딘두요미
1748701,3.7,"Raw Noodles Pasta in Haebangchon 
Let's eat like we're pressed for time
There's a time limit for making saksa, and it makes you drink alcohol no matter what 
A restaurant with strong liver and good snow 
Other than this, I don't know if a good restaurant is good or bad",2023-05-07 15:28:50,"https://image.toast.com/aaaaaqx/rv/s7Agu-DWOBS3tEKBkEHyeRA/230507152736276(0).jpeg, https://image.toast.com/aaaaaqx/rv/s7Agu-DWOBS3tEKBkEHyeRA/230507152736277(1).jpeg, https://image.toast.com/aaaaaqx/rv/s7Agu-DWOBS3tEKBkEHyeRA/230507152736277(2).jpeg, https://image.toast.com/aaaaaqx/rv/s7Agu-DWOBS3tEKBkEHyeRA/230507152736277(3).jpeg",토미세끼
1184506,4.0,Make sure you eat lemon tiramisu Delicious,2022-12-03 21:56:17,,씩씩한 식객_32873
138031,4.0,It was a little salty but delicious. I didn't like truffle thalier but the capellini was delicious. It's worth visiting at least once,2021-10-28 15:28:26,"https://image.toast.com/aaaaaqx/rv/sGH-fb5s4R_O3VqK2Cu8qFw/211028152743395(0).jpeg, https://image.toast.com/aaaaaqx/rv/sGH-fb5s4R_O3VqK2Cu8qFw/211028152743398(1).jpeg",유명한 셀럽_55009
705326,4.0,It was nice to be free and quiet,2022-08-13 10:52:44,,리뷰_5004
259094,4.0,"I like raw noodles the best
It's not salty, but it's
Ragu Yum Yum Yum Red Shrimp is delicious shrimp snack",2022-01-17 22:56:55,https://image.toast.com/aaaaaqx/rv/sGH-fb5s4R_O3VqK2Cu8qFw/22117225622948_rv.jpg,이서니는거꾸로해도이서니
2580787,4.0,"Salsicha lemon butter & yolk chaliatelle, 
Both black pork ragu and black mullet ragutoni pasta were delicious",2024-03-28 00:07:20,"https://ugc-images.catchtable.co.kr/rv/sGH-fb5s4R_O3VqK2Cu8qFw/5d48343fcafc42fdaec1c39fa26ef105, https://ugc-images.catchtable.co.kr/rv/sGH-fb5s4R_O3VqK2Cu8qFw/46f1f80934ec466ab6cb667edb33a143",&&***
574481,5.0,"The pasta was delicious, of course, and the appetizer was great Haha 
I ordered four pasta, but it was so good that none of the flavors overlapped",2022-06-30 18:20:31,,화려한 식객_1686
2021565,4.3,"It's so delicious.. The texture of the pasta is crazy ㅠ 
It's a taste that you won't regret 👍❤️",2023-09-13 17:27:02,"https://ugc-images.catchtable.co.kr/rv/sGH-fb5s4R_O3VqK2Cu8qFw/7ddeef9deffb4dc5b62732de62aa6908, https://ugc-images.catchtable.co.kr/rv/sGH-fb5s4R_O3VqK2Cu8qFw/231c3c23ecc84851b060ddb0e83925b4",jjiiyy22
495818,5.0,"The restaurant that makes the best raw noodles pasta in Korea.
The best restaurant with both views and taste.

You can definitely feel the best taste experience.",2022-05-25 21:48:48,,준일
1595880,4.0,It's always delicious. But it's too bad that dinner time is too late to eat with wine..,2023-02-03 15:43:14,"https://image.toast.com/aaaaaqx/rv/sGH-fb5s4R_O3VqK2Cu8qFw/230203154241307(0).jpeg, https://image.toast.com/aaaaaqx/rv/sGH-fb5s4R_O3VqK2Cu8qFw/230203154241308(1).jpeg",Sic2
2624767,4.0,It's a great view restaurant,2024-04-13 17:25:31,,정혜선브이
318201,4.0,"Rather than shrimp pasta, which is my signature
The galbi ragu pasta was much better!",2022-02-19 18:41:02,https://image.toast.com/aaaaaqx/rv/sGH-fb5s4R_O3VqK2Cu8qFw/220219184059807(0).jpeg,소디와 지디
1748146,4.2,"It was hard to find it, but I really enjoyed the pasta and appetizer",2023-05-07 11:38:27,"https://image.toast.com/aaaaaqx/rv/s7Agu-DWOBS3tEKBkEHyeRA/230507113739450(0).jpeg, https://image.toast.com/aaaaaqx/rv/s7Agu-DWOBS3tEKBkEHyeRA/230507113739451(1).jpeg",쭌쭌이이쭌
2269262,4.2,"It was hard to park, but I tried raw noodle pasta for the first time, and it was interesting and delicious with a different taste",2023-12-17 12:20:47,https://ugc-images.catchtable.co.kr/rv/sGH-fb5s4R_O3VqK2Cu8qFw/ae160cc79d8e439da9a87187ac7afd1d,재능있는 마스터_2249
216489,5.0,"The pasta was really good. The seats on the second floor were not as crowded as on the first floor and the view was good. However, it was a shame that the portion was not enough for us. But I ate it well!",2021-12-26 12:57:09,,Kokuma
1649822,3.7,"The service was great! The staff are kind!
Pasta is seasoned I want to try another pasta next time
Steak is pretty good It's a good place to go on a date",2023-03-05 15:17:14,"https://image.toast.com/aaaaaqx/rv/sGH-fb5s4R_O3VqK2Cu8qFw/230305151530644(0).jpeg, https://image.toast.com/aaaaaqx/rv/sGH-fb5s4R_O3VqK2Cu8qFw/230305151530645(1).jpeg, https://image.toast.com/aaaaaqx/rv/sGH-fb5s4R_O3VqK2Cu8qFw/230305151530646(2).jpeg, https://image.toast.com/aaaaaqx/rv/sGH-fb5s4R_O3VqK2Cu8qFw/230305151530646(3).jpeg",꼬북815
219015,5.0,"I've been to many Michelin places 
Now that my favorite singer is gone 
I love the pasta restaurant that I found again
I'm just thankful for the pasta",2021-12-27 08:56:30,,혹독한미식가
1794311,5.0,"The first place I went today
Please respond kindly and the food tastes great. It's so clean
Love the atmosphere, love the taste of the food, love the kindness..
Totally good, good, good
I think I'll be a regular customer Haha",2023-06-04 15:31:58,,DKNY77
2455087,4.0,"I really enjoyed the meal. It was delicious!
The atmosphere is nice and the view of the store is special",2024-02-09 16:35:45,https://ugc-images.catchtable.co.kr/rv/sGH-fb5s4R_O3VqK2Cu8qFw/d7da169fdcab4078a9f2e8f1f3c31ca6,아름다운 식객_95056
652862,5.0,"Just order the shrimp ink pasta. The thick sauce pasta like the bisque is so delicious, and the carpaccio is surprisingly amazing",2022-07-28 21:36:27,,Nkim0130
1997836,3.7,"The atmosphere is nice and the view is pretty. But the food was a little disappointing, and the price of the wine was very bubbly. You can call me. I recommend you call me.",2023-09-04 00:07:41,"https://ugc-images.catchtable.co.kr/rv/sGH-fb5s4R_O3VqK2Cu8qFw/929fd443672b428ab0f60f196c5904d0, https://ugc-images.catchtable.co.kr/rv/sGH-fb5s4R_O3VqK2Cu8qFw/ef178b4d24f3459a975a3196ea0bd9b9, https://ugc-images.catchtable.co.kr/rv/sGH-fb5s4R_O3VqK2Cu8qFw/5261b6bb547b4542971db2c5c4a6df35",불주먹피바다
365305,5.0,"We met for a birthday party and the staff were so kind 
The food was a little small, but it was delicious 
I ordered a lot, so I was full and ate well!",2022-03-17 20:47:15,,국예송
1025583,4.0,"a lovely atmosphere. 
Ragu, oil pasta was delicious :)",2022-11-03 10:08:53,https://image.toast.com/aaaaaqx/rv/sGH-fb5s4R_O3VqK2Cu8qFw/221103100744806(0).jpeg,Y__jae
2191011,4.3,A place with a really nice view. It's kind and tastes like pasta,2023-11-19 14:28:10,https://ugc-images.catchtable.co.kr/rv/sGH-fb5s4R_O3VqK2Cu8qFw/80559252cb5341d8954d480b8d8d1b99,윤다솜916
1687424,4.0,I enjoyed the pasta in a warm atmosphere :),2023-03-29 10:44:41,https://image.toast.com/aaaaaqx/rv/s7Agu-DWOBS3tEKBkEHyeRA/230329104417428(0).jpeg,구운카레
2570536,5.0,"When you sit on the terrace, the picture comes out well! 
Everything on the menu is really good :)
The menu explanation was smooth, so I thought it was Michelin!",2024-03-24 09:29:16,,상냥한
385926,5.0,"I visited to celebrate my birthday.
I was very satisfied with all the food I ordered. 
Eggs and flowers that allowed us to have a great time! Thank you",2022-03-30 21:35:21,,Hghghgsis
1832893,4.2,The view is so nice. The flavor was too strong.,2023-06-26 14:48:55,https://image.toast.com/aaaaaqx/rv/sGH-fb5s4R_O3VqK2Cu8qFw/230626144839163(0).jpeg,돼지런 원숭이
434514,5.0,"I went there with a friend who really likes pasta, and it was so nice because I really liked it It was strong but delicious!!",2022-04-27 23:27:34,,유가령
439659,5.0,"I had a great meal today~ Everyone is kind and the view is good and the food is delicious, so I'm going to go again next time!!",2022-04-30 21:44:05,,이이한한솔솔
684773,5.0,"Only four parking lots are available. Keep that in mind.
Overall, it's delicious, and the pickles are very delicious!
I recommend it!",2022-08-06 19:44:51,,SangWoo12
250229,5.0,"The noodles are so chewy and delicious
All the dishes were original and delicious
The servers were so kind, so I felt good",2022-01-13 13:18:28,,윤진이잉
1442118,4.3,"It's delicious.
I don't really leave reviews, but it's really good",2022-12-31 16:16:14,https://image.toast.com/aaaaaqx/rv/sGH-fb5s4R_O3VqK2Cu8qFw/221231161613391(0).jpeg,ae레오
2496932,5.0,We had a wedding invitation meeting and it was delicious and good! Everything was delicious and the staff was kind. ^^ I had a good memory. I'm willing to revisit!,2024-02-24 23:10:10,,플랭크천재
1646020,5.0,"Egg and flower that I always trust and eat! 
I heard the bar on the upper floor was open, and it was good because it was served on the house I recommend a bar, too 👍",2023-03-03 18:58:51,"https://image.toast.com/aaaaaqx/rv/sGH-fb5s4R_O3VqK2Cu8qFw/230303190001000(0).jpeg, https://image.toast.com/aaaaaqx/rv/sGH-fb5s4R_O3VqK2Cu8qFw/230303190001001(1).jpeg",새로운 식도락가_81120
1735214,5.0,The atmosphere was so good. I ordered galbi and the texture of the pasta was unbelievably good. Thank you for your kind response.,2023-04-30 00:04:13,,외로운 미식가_9553
1845094,5.0,It was the best meal.   I want to taste all the menus. I feel like I should come more often with my parents and precious friends.,2023-07-03 12:50:45,,sung6580
171405,5.0,"It doesn't seem like you've eaten it somewhere, but if you eat it, you can find something different from other restaurants!",2021-11-27 14:18:05,,안주창고
595913,5.0,"He's so kind and has a good view and changes the lights every minute, so I love it!
The chuck flap tail steak is so good too",2022-07-09 22:03:15,,셍이이이리
1649431,5.0,"Wonderful! Nice food, nice view, nice service, pleasant atmosphere.",2023-03-05 11:25:57,,EeAaTt
1755890,5.0,"I don't take pictures with my girlfriend's phone, but..It was the most satisfying restaurant I've been to recently
Thanks to you, I got compliments from my girlfriend!!",2023-05-11 21:55:25,,허석이다이마이야르르
342106,5.0,Kind service! A cozy atmosphere! Delicious food! And Namsan Tower view,2022-03-03 15:05:27,,김권호
224298,5.0,"I was assigned a seat in front of the door due to a late reservation, but thank you for your consideration! :)",2021-12-30 02:45:51,,야끼니꾸테이쇼쿠
252092,5.0,"It's been a long time since I ate delicious pasta and I'm excited. Next time, I'd like to come in the evening and have other menus and wine together",2022-01-14 14:28:38,,Angrypanda
1839035,5.0,"Eggs and flowers are the best for pasta!! Among them, lemon butter pasta is so delicious that you can eat it every day!! ❤️🌹",2023-06-30 16:09:12,,graphicat
2230062,3.7,"It was delicious, but it was not a pleasant memory because it was unfriendly in service.  I can't recommend it to people who ask.",2023-12-03 19:30:40,"https://ugc-images.catchtable.co.kr/rv/sGH-fb5s4R_O3VqK2Cu8qFw/f6d013c734e441c08ceb63f3d838641f, https://ugc-images.catchtable.co.kr/rv/sGH-fb5s4R_O3VqK2Cu8qFw/10c8e9633306470fa43686f9ffd7b271, https://ugc-images.catchtable.co.kr/rv/sGH-fb5s4R_O3VqK2Cu8qFw/ca7fb8b011a34425a880bae0fe6b42cf",Momoco
2489511,5.0,"I was very satisfied with the high level of pasta :)
I especially liked bulgogi pasta.
It's a great place to go on an anniversary",2024-02-22 11:44:58,,경쾌한 식도락가_73975
1852436,5.0,"The weather was nice, so I was very happy because I could enjoy unique pasta at the window where the sun was shining",2023-07-08 08:11:48,,aorikun
1993104,4.2,I ate it deliciously!!,2023-09-02 19:37:48,"https://ugc-images.catchtable.co.kr/rv/sGH-fb5s4R_O3VqK2Cu8qFw/fef8ffdeaedd485ea2f9087ff8b9a538, https://ugc-images.catchtable.co.kr/rv/sGH-fb5s4R_O3VqK2Cu8qFw/c1b04ac3d95d45be8fb5c0cb069d818a",Damin Yang
473271,5.0,"It's a place that comes to mind often!
The dishes are pretty, but the taste is so good. :)",2022-05-15 13:55:19,,Chopchop1.1
520958,5.0,The view was perfect and the three pasta I tasted was delicious without any shortage :-),2022-06-06 01:09:30,,유게링
2529844,5.0,It's really really good. They were so kind and the atmosphere was so good I'm going to go again next time. The terrace looks good,2024-03-08 19:19:43,,온화한 마스터_7530
1577846,5.0,"All the food was so delicious and especially the staff was so kind, so I had a good time. Thank you",2023-01-22 20:34:10,,제온잔
393480,5.0,The amount was very appropriate and I was satisfied with the harmony between the menus. It's very delicious. I really want to come back next time,2022-04-04 16:43:56,,쾌활한 마스터_93369
1000488,4.0,It was delicious,2022-10-28 21:46:09,"https://image.toast.com/aaaaaqx/rv/sGH-fb5s4R_O3VqK2Cu8qFw/221028214558276(0).jpeg, https://image.toast.com/aaaaaqx/rv/sGH-fb5s4R_O3VqK2Cu8qFw/221028214558278(1).jpeg",이이이이삼
547745,5.0,It was so delicious!! Thank you for listening so kindly to my demanding requests!!!,2022-06-18 14:02:35,,랴슈리트
2379329,4.0,The night view is pretty,2024-01-13 21:07:47,https://ugc-images.catchtable.co.kr/rv/sGH-fb5s4R_O3VqK2Cu8qFw/536bcbd673fe4c64b8f3e15fe3854f44,Hwang8399
2462199,5.0,"I visited because of my father's birthday, and everyone enjoyed eating because of the clean, strong, new, and familiar taste",2024-02-12 15:39:42,,Civ
720668,5.0,"It's the essence of raw noodles. It's my first time eating raw noodles, and the texture on my tongue is soft and chewy!",2022-08-16 23:38:02,,llewyn
1547500,5.0,The food was so delicious and the staff was so kind.. 🥺 I want to visit again 💗💗,2023-01-13 21:48:58,,영아영아
2228324,5.0,"I feel it every time, but this visit was also a time where I fell in love with the careful consideration and sincerity of each dish~^^",2023-12-03 12:08:50,,삐마담
2578474,5.0,"I sat on the terrace, and the view is so pretty. It's the best to go on an anniversary Highly recommended 
The food was really good too!!",2024-03-26 20:49:07,,조용한 식객_41780
1886506,5.0,"The service and taste are great!! 
Thanks to you, I had a great time! 
Thank you!!!!",2023-07-26 17:13:13,,뽁주
975678,5.0,"Delicious raw noodles pasta and chuck flap tail steak
It's really good
But the traffic in the neighborhood is not good, so keep that in mind!",2022-10-22 22:58:03,,찰싹
2211765,5.0,"Every single food is so delicious..  
I'm 300% willing to visit again",2023-11-26 21:56:19,,GetRich
350230,5.0,"The pasta was so good and the view was so good
The kind boss and staff are the best👍👍",2022-03-08 20:48:29,,Ahyun
1712832,5.0,"Maybe it's because it's raw noodles, but I ate it comfortably and deliciously.  Even if it rained, the scenery and the scenery were all good.",2023-04-15 18:12:37,,레지나k
501377,5.0,I visited for the anniversary. I was able to celebrate it with delicious food. Thank you,2022-05-28 18:00:42,,활기찬 셀럽_68727
1019240,5.0,The atmosphere was so good  It was a happy evening I'm so sad that I couldn't eat dessert,2022-11-01 09:57:56,,agatha52
1300804,5.0,The rustiness of ink pasta...The taste of the sauce that I can't forget 👍 The atmosphere is pleasant and clean. Strongly recommend,2022-12-18 20:13:58,,도산로13
1584014,3.7,"It's too close to the seat next to me..
It's really good, but it's too little for the price",2023-01-27 08:56:29,"https://image.toast.com/aaaaaqx/rv/sGH-fb5s4R_O3VqK2Cu8qFw/23127085544848_rv.jpg, https://image.toast.com/aaaaaqx/rv/sGH-fb5s4R_O3VqK2Cu8qFw/23127085545338_rv.jpg, https://image.toast.com/aaaaaqx/rv/sGH-fb5s4R_O3VqK2Cu8qFw/23127085545828_rv.jpg, https://image.toast.com/aaaaaqx/rv/sGH-fb5s4R_O3VqK2Cu8qFw/23127085546254_rv.jpg",김민석080802
1612946,5.0,"It's so good (Crying) 
I'm so touched. x10000
I think I like raw noodles.",2023-02-12 23:21:03,,66이
347383,5.0,"I had a great time Thank you.
I had a great time Thank you.",2022-03-06 19:44:29,,포수
1906492,5.0,Very nice and cozy environment with good food.,2023-08-02 15:23:43,,ㅂㅣㄱㅏㄴ
2560476,5.0,https://m.blog.naver.com/slee8787/223387974505,2024-03-19 22:16:52,,레나코코8787
499235,3.5,"Cooking was just normal 
It was nice that the staff were kind!",2022-05-27 17:58:09,"https://image.toast.com/aaaaaqx/rv/sGH-fb5s4R_O3VqK2Cu8qFw/220527175802740(0).jpeg, https://image.toast.com/aaaaaqx/rv/sGH-fb5s4R_O3VqK2Cu8qFw/220527175802745(1).jpeg, https://image.toast.com/aaaaaqx/rv/sGH-fb5s4R_O3VqK2Cu8qFw/220527175802746(2).jpeg, https://image.toast.com/aaaaaqx/rv/sGH-fb5s4R_O3VqK2Cu8qFw/220527175802746(3).jpeg",데롱여우
1168760,5.0,"Red shrimp pasta is ㅈ입니다. 
I've tried so many pasta, but it's the best.",2022-12-01 14:57:09,,seandcw
84852,5.0,"The view is so nice! I visited on a sunny day during the day, and the atmosphere was so good",2021-08-29 14:03:23,,kaatieunkky
258530,5.0,"It was so delicious and kind service, and it became a more enjoyable meal
Thank you",2022-01-17 19:25:08,,진진진진찐
2024065,5.0,"Amazing experience, superb food and service",2023-09-14 21:00:45,,Nicole  Farrugia 230821220219
2196688,5.0,"Is parking very difficult due to the characteristics of Itaewon and Liberation Village
The taste and atmosphere are good enough to live with",2023-11-21 12:54:03,,부드러운 식도락가_91700
156193,5.0,"Even if it's hard on the way, the night view is pretty
Red shrimp bisque pasta is delicious",2021-11-14 14:24:09,,흑임자인절미
1168214,5.0,"There was no lack of taste, service, or view.
I'll visit you again soon :)",2022-12-01 13:23:31,,갤러헤드
1671881,5.0,"I saw Namsan Tower and the atmosphere was good, so I had a great time with wine on the anniversary",2023-03-19 10:48:11,,똑똑한 미식가_19874
2193174,5.0,The staff are kind and the texture of the raw noodles is so delicious. The window view is also very pretty.,2023-11-19 23:52:25,,최고의 식객_71533
2376536,5.0,"It's really good!!!!! Especially, pasta with shrimp on top comes to mind periodically.ㅜ",2024-01-13 08:59:45,,릿또
50007,5.0,"It was more delicious than I expected~;

The service was good, too!",2021-07-11 15:06:27,,희한해
442671,5.0,"They served us kindly, and the pasta was so delicious!!",2022-05-02 00:00:28,,부지런하자
592790,5.0,Pasta that even those who don't like pasta can't help but like it... This is love...!,2022-07-09 02:17:02,,화려한 미식가_41258
2456077,5.0,It was such a great dinner I want to try another menu next time,2024-02-09 21:43:32,,공대영
2466694,5.0,"It's kind and delicious They say it's a bit salty, but it's delicious 
Lemon butter is the best",2024-02-14 12:20:57,,우리아이가달러줬어요
